ID,Company,Job Title,Location,Description
1542b1b201d54e15ab53448d79163a97,Mastercard,Senior DevOps Engineer,"Dublin, County Dublin, Ireland Hybrid","Our Purpose

We work to connect and power an inclusive, digital economy that benefits everyone, everywhere by making transactions safe, simple, smart and accessible. Using secure data and networks, partnerships and passion, our innovations and solutions help individuals, financial institutions, governments and businesses realize their greatest potential. Our decency quotient, or DQ, drives our culture and everything we do inside and outside of our company. We cultivate a culture of inclusion for all employees that respects their individual strengths, views, and experiences. We believe that our differences enable us to be a better team – one that makes better decisions, drives innovation and delivers better business results.

Job Title

Senior DevOps Engineer

The Connect BizOps team is looking for a Site Reliability/DevOps Engineer who can help us solve problems, build our CI/CD pipeline and lead Mastercard in DevOps automation and best practices.

 Are you a born problem solver who loves to figure out how something works?
 Are you a CI/CD geek who loves all things automation?
 Do you have a low tolerance for manual work and look to automate everything you can?


Business Operations is leading the DevOps transformation at Mastercard through our tooling and by being an advocate for change & standards throughout the development, quality, release, and product organizations. We need team members with an appetite for change and pushing the boundaries of what can be done with automation. Experience in working across development, operations, and product teams to prioritize needs and to build relationships is a must.

Mission

The role of business operations is to be the production readiness steward for the platform. This is accomplished by closely partnering with developers to design, build, implement, and support technology services. A business operations engineer will ensure operational criteria like system availability, capacity, performance, monitoring, self-healing, and deployment automation are implemented throughout the delivery process. Business Operations plays a key role in leading the DevOps transformation at Mastercard through our tooling and by being an advocate for change and standards throughout the development, quality, release, and product organizations.

We accomplish this transformation through supporting daily operations with a hyper focus on triage and then root cause by understanding the business impact of our products. The goal of every biz ops team is to shift left to be more proactive and upfront in the development process, and to proactively manage production and change activities to maximize customer experience, and increase the overall value of supported applications. Biz Ops teams also focus on risk management by tying all our activities together with an overarching responsibility for compliance and risk mitigation across all our environments. A biz ops focus is also on streamlining and standardizing traditional application specific support activities and centralizing points of interaction for both internal and external partners by communicating effectively with all key stakeholders.

Ultimately, the role of biz ops is to align Product and Customer Focused priorities with Operational needs. We regularly review our run state not only from an internal perspective, but also understanding and providing the feedback loop to our development partners on how we can improve the customer experience of our applications.

Responsibilities

 Engage in and improve the whole lifecycle of services—from inception and design, through deployment, operation and refinement.
 Analyze ITSM activities of the platform and provide feedback loop to development teams on operational gaps or resiliency concerns
 Support services before they go live through activities such as system design consulting, capacity planning and launch reviews.
 Maintain services once they are live by measuring and monitoring availability, latency and overall system health.
 Scale systems sustainably through mechanisms like automation, and evolve systems by pushing for changes that improve reliability and velocity.
 Support the application CI/CD pipeline for promoting software into higher environments through validation and operational gating, and lead Mastercard in DevOps automation and best practices.
 Practice sustainable incident response and blameless postmortems.
 Take a holistic approach to problem solving, by connecting the dots during a production event thru the various technology stack that makes up the platform, to optimize mean time to recover
 Work with a global team spread across tech hubs in multiple geographies and time zones
 Share knowledge and mentor junior resources


Qualifications

 BS degree in Computer Science or related technical field involving coding (e.g., physics or mathematics), or equivalent practical experience.
 Experience with algorithms, data structures, scripting, pipeline management, and software design.
 Systematic problem-solving approach, coupled with strong communication skills and a sense of ownership and drive.
 Ability to help debug and optimize code and automate routine tasks.
 We support many different stakeholders. Experience in dealing with difficult situations and making decisions with a sense of urgency is needed.
 Experience in one or more of the following is preferred: C, C++, Java, Python, Go, Perl or Ruby.
 Interest in designing, analyzing and troubleshooting large-scale distributed systems.
 We need team members with an appetite for change and pushing the boundaries of what can be done with automation. Experience in working across development, operations, and product teams to prioritize needs and to build relationships is a must.
 Experience in industry standard CI/CD tools like Git/BitBucket, Jenkins, Maven, Artifactory, and Chef. Experience designing and implementing an effective and efficient CI/CD flow that gets code from dev to prod with high quality and minimal manual effort is desired.""


COVID-19 Considerations 

We value the safety of each member of our community because we know we’re all in this together. In many locations, which may change over time, we’ve implemented a virtual hiring process and continue to interview candidates by video or phone. In addition, in some locations, only individuals who have been fully vaccinated will be permitted inside Mastercard offices until further notice.

In the US, Mastercard is a government contractor, which may legally require most Mastercard employees to be vaccinated unless a verified approved medical or religious exemption is granted. Further, we are currently making every effort towards having employees return to work in the office 2 days per week, if that makes sense for their team. Everyone must be vaccinated to enter Mastercard offices at this time. Therefore, we expect all candidates to be vaccinated or to be approved for a medical or religious accommodation prior to commencing work at Mastercard.

Corporate Security Responsibility

All Activities Involving Access To Mastercard Assets, Information, And Networks Comes With An Inherent Risk To The Organization And, Therefore, It Is Expected That Every Person Working For, Or On Behalf Of, Mastercard Is Responsible For Information Security And Must

Abide by Mastercard’s security policies and practices;
Ensure the confidentiality and integrity of the information being accessed;
Report any suspected information security violation or breach, and
Complete all periodic mandatory security trainings in accordance with Mastercard’s guidelines."
9d6a1421d49248d1a114b1fd0eb4d398,Dell Technologies,Principal DevOps Engineer,Ireland Remote,"Principal DevOps Engineer, DFS CoE Team

Dell Digital is transforming our workforce to be product aligned and in doing so will enable new business capabilities at a faster rate, increase in the quality, stability, and security of our software ecosystems and reduce the cost of software delivery. The DFS Release & Reliability Centre of Excellence (COE) team aims to enable this through centralizing specific functions to provide consistency and efficiency, coordinating certain DFS Digital activities and providing a single point of contact for DFS Digital into Dell Digital, supporting a high level of stability in production and providing appropriate governance, observability, monitoring, automation of our change, release and compliance processes.

Join us as an Principal DevOps Engineer, on DFS Release & Reliability Centre of Excellence team in to do the best work of your career and make a profound social impact.

What You’ll Achieve

The DFS CoE is looking for a Principal DevOps Engineer who will contribute to the driving governance, automation, process improvements that help in stability, reliability of our applications as we try to deliver fast.

You will be driving standardization, building the required dashboards to measure the health of applications from release quality, code quality, and stability. You will have the opportunity to put in place a process and for driving product release governance, measuring feedbacks, identifying inconsistencies, etc.

We need a passionate individual who can scale across roles and is flexible to work with a diverse team. Strong Collaboration, communication skills will be a good fit.

You will:

Driving Gitlab CI/CD standardization within applications under DFS Digital.
Developing Automated reporting dashboards to show versions, code quality metrics, security metrics, etc.
Drive the software development process towards quality-centric methodologies and improved reliability, stability.
Pro-actively analyses current software delivery processes and practices and suggest/ drive improvements.
Provide Automation Support to DFS Release Management Team and drive automation that improves maturity .


Take the first step towards your dream career

Every Dell Technologies team member brings something unique to the table. Here’s what we are looking for with this role:

Essential Requirements

Knowledge of DevOps engineering practices, CI/CD toolsets (e.g. Jenkins, GitLab, SonarQube, etc.)
Automation Experience – Python, Ruby, PowerShell, Grafana, etc.
Experience in deployment automation and CI/CD Pipeline stages/activities, experience on Docker/Containers and delivering applications in Blue/Green and Canary paths with good exposure to Git.
Experience building DevOps and Test automation capabilities from ground up for a cloud based and legacy software solutions.
Experience in Visual Studio, TFS, Git, Eclipse, Selenium, Cucumber, Spec Flow, DevOps tool chain and other Open Source tools.


Desirable Requirements

Release Governance, Test Governance experience.
Software Engineering Development Background – At least 10+years


Here’s our story; now tell us yours

Dell Technologies helps organizations and individuals build a brighter digital tomorrow. Our company is made up of more than 150,000 people, located in over 180 locations around the world. We’re proud to be a diverse and inclusive team and have an endless passion for our mission to drive human progress.

What’s most important to us is that you are respected, feel like you can be yourself and have the opportunity to do the best work of your life -- while still having a life. We offer excellent benefits, bonus programs, flexible work arrangements, a variety of career development opportunities, employee resource groups, and much more.

We started with computers, but we didn’t stop there. We are helping customers move into the future with multi-cloud, AI and machine learning through the most innovative technology and services portfolio for the data era. Join us and become a part of what’s next in technology, starting today.

You can also learn more about us by reading our latest Diversity and Inclusion Report and our plan to make the world a better place by 2030 here.

Application closing date: 30 May 2022

Dell is committed to the principle of equal employment opportunity for all employees and to providing employees with a work environment free of discrimination and harassment. All employment decisions at Dell are based on business needs, job requirements and individual qualifications, without regard to race, color, religion or belief, national, social or ethnic origin, sex (including pregnancy), age, physical, mental or sensory disability, HIV Status, sexual orientation, gender identity and/or expression, marital, civil union or domestic partnership status, past or present military service, family medical history or genetic information, family or parental status, or any other status protected by the laws or regulations in the locations where we operate. Dell will not tolerate discrimination or harassment based on any of these characteristics. Dell encourages applicants of all ages. Read the full Employment Opportunity Policy here.

Job Id: R121820Job Function: Information Technology

"
2f6785ebec424547914cdb723eb9ede0,Marco Polo Network,Senior DevOps Engineer,"Dublin, County Dublin, Ireland Hybrid","You will be responsible for:

Making the Marco Polo Network scale effectively. You will build and operate the CI\CD platforms that help our engineering team develop and release features with constant predictable flow. Our DevOps scope extends into the realm of the day-to-day network management. We build tools to streamline processes, and which accelerates Marco Polo Network’s Operations capabilities as we scale.




On any given day you might:

Design, build, and run systems behind the Marco Polo Network
Create an ecosystem of tools that help developers be at their best
Plan for the growth of Marco Polo Network’s infrastructure
Implement more effective ways of supporting our clients and team
Find innovative ways to overcome complex technical challenges
Reporting the right things in the right way at the right time
Acting as a gatekeeper you will work in a way that protects our people, systems and complies with our InfoSec and security policies and procedures
Continuously improve how we get things done; recommend and implement better faster more effective ways of supporting our clients and team
Effectively execute any special projects or ad-hoc tasks as assigned




You will bring:

Hands-on experience with:

Containers and container orchestration (Docker, Kubernetes, Openshift) 
Programming language (Golang, Python) 
Scripting language (Bash, Powershell, Groovy) 
Databases (PostgreSQL, ElasticSearch) 
Kubernetes (CRDs, Operators) 
Observability tools (Prometheus, Kibana, Opentracing, Grafana) 
Data pipelines (Spark, Kafka, Azure Datalakes) 
Networking (Istio, Kong, Nginx etc) 
Cloud (Azure, GCP, IBM Cloud)




A programming background and an experience writing tools for engineers, both in development and operations.
Experience developing, maintaining and debugging distributed systems
Experience building and running cloud infrastructure
Experience optimizing the reliability and security of distributed systems
Experience scaling and migrating systems in a changing environment that allows for little to no downtime
Experience with blockchain or distributed ledger technologies
Experience creating and maintaining data pipelines
An excitement to learn new things
A desire to solve difficult problems
A pragmatic ability to ship results iteratively
Highly proactive and effective written and verbal communication skills
Ability and willingness to take initiative and get things done
A strong desire to exceed client expectation’s (internal & external) is a must
An entrepreneurial and adaptable approach is a pre-requisite




What you can expect:

Life in a fast-moving start-up environment and all that entails.
Competitive salary
25 days annual leave (plus bank holidays), pension scheme
Flexi-lifestyle benefits (tailor your options to what is important to you; i.e. Health care, fitness, travel, continuous professional development etc)
MacBook or Dell XPS? You choose the type of equipment you need to work more efficiently
Keep active with numerous fitness team events and challenges organised throughout the year
Growing your family? We know how important those first few months are for both parents and we are offering paid leave for both mums and dads so you can enjoy the new arrival!
All the tools and supports needed to do an excellent job
Ability to make a difference
A dynamic workplace with a great balance of hard work and fun
A culture of innovation and a structure in which to innovate
A nurturing team-oriented environment with mentorship as a key feature of the dynamic"
65e689dcf3e14a4c9715e180b18268ea,Workday,DevOps Software Engineer,"Dublin, County Dublin, Ireland","Do What You Love. Love What You Do.

At Workday, we help the world’s largest organizations adapt to what’s next by bringing finance, HR, and planning into a single enterprise cloud. We work hard, and we’re serious about what we do. But we like to have fun, too. We put people first, celebrate diversity, drive innovation, and do good in the communities where we live and work.

About The Team

The Customer Deployment Tools (CDT) organization builds tools to help implement Workday for new customers. You will be joining a team to work on tools that help CDT engineering teams deliver value faster, with high quality and low risk. We care about the developer experience as much as about the products they deliver to Workday customers, and work to provide safe and sustainable development environments, supporting CI/CD tools and practices.

Our mission is to enable fast, simple and reliable delivery of value, reduce the cost of ownership and provide early feedback to support data-driven decisions. In order to achieve this, we build easy-to-use, self-service, opinionated, open-source solutions that encourage collaboration, and provide easy access to a reliable delivery infrastructure.

About The Role

We are looking for a software engineer who understands the process of software development, the agile philosophy and devops principles, and looks to improve and optimize them for their fellow engineers.

Basic qualifications:

Proficiency in object-oriented and scripting languages.
Experience building CI/CD pipelines.
Experience with build tools.
Good working knowledge of Git and Linux.


Other qualifications:

Bash and Python.
Jenkins, Artifactory, TeamCity or Spinnaker.
Gradle, Maven or SBT.
Docker and Kubernetes.
Chef and configuration management.


About You

You are a great teammate, collaborative, outspoken and fun to work with. You are willing to run internal projects and promote them outside the team, for example doing build guild presentations or networking with similar teams. You care about the solutions that you deliver, about their quality and about the development process.

#IJ

Are you being referred to one of our roles? If so, ask your connection at Workday about our Employee Referral process!

"
8c42bc074b0545b8be088cd3ff4bff5b,Google,"Cloud Infrastructure Engineer, Managed Infrastructure Operations","Dublin, County Dublin, Ireland","Minimum qualifications:

Bachelor's degree in computer science, mathematics, or a related technical field such as software engineering, or equivalent practical experience.
Experience maintaining internet facing production-grade applications in virtualized environments (e.g., Google Cloud Platform and other cloud computing platforms).
Experience writing software in languages, such as Java, Python, Go, JavaScript, C++, or similar.


Preferred qualifications:

Experience with scalable networking technologies (i.e., Load Balancers, Firewalls) and web standards (i.e., REST APIs, web security mechanisms).
Experience with deployment and orchestration technologies (i.e., Docker, Kubernetes, Mesos, OpenStack, Puppet, Chef, Salt, Ansible, Jenkins).
Experience designing, building, and deploying scalable cloud-based solution architectures.
Experience working with and managing external partners/customers.
Experience in system administration tasks in Linux or Unix and familiarity with standard IT security practices (i.e., encryption, certificates, key management).
Understanding of open source server software (i.e., NGINX, RabbitMQ, Redis, Elasticsearch).


The purpose of the Infrastructure Operations Practice is to deploy, manage, and operate complex customer environments, support our partners who operate environments on our behalf, and extend the capabilities of Google Cloud beyond the boundaries of our own data centers to hosted and edge data centers.

As a Cloud Infrastructure Engineer, you will help our customers and partners deploy, configure, manage, monitor, and automate their data center systems, including OS, hardware, networking, storage, and business tools. You will guide customers on configuring and deploying their Google Cloud infrastructure. You will consult with customers on designing their cloud applications for optimal scaling including content delivery network (CDN) design, load balancer setup, caching, compute optimizations, continuous integration, and delivery pipeline. You'll deploy solutions and deliver workshops to educate and empower customers. Additionally, you will work closely with Product Management and Product Engineering to drive excellence in Google Cloud products and features.


Advise customers and solve complex Google Cloud Infrastructure and Developer Tools and Signals challenges.
Create and deliver best practices recommendations, tutorials, blog articles, sample code, and technical presentations adapting to different levels of business and technical stakeholders.
Provide technical implementation support in customer environments, including guidance on implementation feasibility of cross-product integrations.


Google is proud to be an equal opportunity workplace and is an affirmative action employer. We are committed to equal employment opportunity regardless of race, color, ancestry, religion, sex, national origin, sexual orientation, age, citizenship, marital status, disability, gender identity or Veteran status. We also consider qualified applicants regardless of criminal histories, consistent with legal requirements. See also Google's EEO Policy and EEO is the Law. If you have a disability or special need that requires accommodation, please let us know by completing our Accommodations for Applicants form ."
