ID,Company,Job Title,Location,Description
3af06a32ea47410bbeefeb84dad712fb,General Motors,Site Reliability Engineer,"Limerick, County Limerick, Ireland On-site","There’s never been a more exciting time to work for General Motors.

To achieve our vision of a world with Zero Crashes, Zero Emissions and Zero Congestion, we need people to join us who are passionate about creating safer, better and more sustainable ways for people to get around. This bold vision won’t happen overnight, but just as we transformed how the world moved in the last century, we are committed to transforming how we move today and in the future.

Why Work for Us

Our culture is focused on building inclusive teams, where differences and unique perspectives are embraced so you can contribute to your fullest potential as you pursue your career. Our locations feature a variety of work environments, including open work spaces and virtual connection platforms to inspire productivity and flexible collaboration. And we are proud to support our employees volunteer interests, and make it a priority to join together in efforts that give back to our communities.

You should have excellent communication skills and the ability to demonstrate comfort, interest and aptitude for learning and manipulating technology platforms. This role will be accountable to manage production and/or non-production environments. This position will manage multiple priorities effectively, work independently and thoroughly assess written content. Ideal candidates will display knowledge in ITIL and service orientation, have a strong aptitude in problem-solving and be able to work virtually within global teams while innovating and completing projects and tasks under tight deadlines. Work will largely be guided through service requests and coordination with the release management team.

Proficiency in service-level changes to systems and troubleshooting components
Perform configuration, service, incident, and problem management functions
Perform change, release, security, patch, and certificate management activities
Engineer and deploy enhancements to production and non-production systems
Work with teams to manage the agreed upon SLA’s
Work with teams to improve the reporting & operational policies and procedures
Participate in off-duty or on-call work as required in a rotation.

Knowledge/Skills/Abilities

Familiar with a variety of IT Support concepts, practices, and procedures. Relies on experience and judgment to plan and accomplish goals. Performs a variety of complicated tasks.

Degree in Computer Science, Information Systems or other related discipline or equivalent work experience
1-3 years experience with operational understanding of Server Operating Systems (Unix/Linux, Windows) VMware & Middleware technologies, with experience supporting varying configurations and distributions and the ability to Document procedures, runbooks, and environments.
Strong troubleshooting and debugging skills in a high-pressure environment working with application, network, security, and development teams
Experience writing code in Shell, PowerShell, Python, Ruby, Java, or similar language.
Collaborate cross-functionally with customers and support teams to identify and drive SLAs/SLOs, Resiliency, and Performance.
Ability to analyze situations, speak up respectfully, and share innovative ideas
Strong work ethic in a mission-critical 24x7x365 diverse environment with multiple vendor/customer relationships

Diversity Information

General Motors is committed to being a workplace that is not only free of discrimination, but one that genuinely fosters inclusion and belonging. We strongly believe that workforce diversity creates an environment in which our employees can thrive and develop better products for our customers. We understand and embrace the variety through which people gain experiences whether through professional, personal, educational, or volunteer opportunities.

We encourage interested candidates to review the key responsibilities and qualifications and apply for any positions that match your skills and capabilities."
c7013f2371a24051a79e00a454b559c2,JPMorgan Chase & Co.,Site Reliability Engineer - Transfer Agency,"Dublin, County Dublin, Ireland On-site","Site Reliability Engineers (SREs) in Application Development apply software and infrastructure engineering skills to run, maintain and improve service / product against established Service Level Objectives: availability, performance, change management, capacity management and improvement of monitoring and diagnostic platforms. They work closely with the business to deliver critical data to the Firm's institutional clients; to resolve urgent production problems; are expected to employ their skills to continuously streamline and stabilize processing. SREs must work well in a team environment.


 Linux -Advanced 
 SQL - Advanced 
 Windows - Advanced is a plus 
 Scripting (such as Shell/Perl or PowerShell) 
 Knowledge of production application environments and components including database design and performance (such as Oracle, MS SQL); virtual servers (such as VMWare); monitoring platforms (such as Geneos); application resiliency automation; scheduling tools (such as Autosys); load balancing (such as DR pairs, CNAMES, A-Record); transmission protocols (such as SFTP, NDM); Messaging tools (such as MQ, KAFKA) 
 BS or MS in Computer Science highly desired 
 Service Now - a plus 
 Investment Banking Financial Services (such as institutional markets, post trade technology, prime brokerage and fund services) a plus 

J.P. Morgan is a global leader in financial services, providing strategic advice and products to the world's most prominent corporations, governments, wealthy individuals and institutional investors. Our first-class business in a first-class way approach to serving clients drives everything we do. We strive to build trusted, long-term partnerships to help our clients achieve their business objectives.

We recognize that our people are our strength and the diverse talents they bring to our global workforce are directly linked to our success. We are an equal opportunity employer and place a high value on diversity and inclusion at our company. We do not discriminate on the basis of any protected attribute, including race, religion, color, national origin, gender, sexual orientation, gender identity, gender expression, age, marital or veteran status, pregnancy or disability, or any other basis protected under applicable law. In accordance with applicable law, we make reasonable accommodations for applicants' and employees' religious practices and beliefs, as well as any mental health or physical disability needs."
16fa3a00462744ada41c7af1a022c884,DMCG Global,DevOps Engineer AWS,"Dublin, County Dublin, Ireland Hybrid","We are looking for a DevOps Engineer near Dublin, Ireland. This role would ideally suit a DevOps enthusiast who is comfortable operating in a highly collaborative fast-paced environment with a can-do attitude. Culture is critically important to the team, team members are expected to contribute positively via knowledge sharing, mentorship and peer-reviewing each other’s work. On-going development of skills and knowledge is highly encouraged.

 

Key Responsibilities:




Building the core services that enable Datalex engineering teams to work efficiently
Infrastructure Automation (ex. Terraform)
Migrating on-premises workloads to AWS
Working with product owners and architects to design and build systems that enable the Datalex software to run on AWS
Working within the platform certification team to design and build the pipelines of infrastructure that are needed to run the processes required to certify our core software
Working closely with development teams with issues and new requests for resources 

 

Technical Skills / Knowledge/ Experience:




Essential (Active use of the following):




High level of comfort working with Linux systems, administration and scripting
Good working knowledge of Internet services (SSL/TLS, DNS)
Infrastructure automation (ex. Terraform)
Configuration management solutions (ex. SaltStack, Ansible) 
Cloud technologies (ex. AWS)
CI/CD (ex Jenkins)
2+ years of experience in a role utilizing above

 

Desired (Knowledge and use of the following):




Docker and orchestration (ex. Kubernetes)
Setup and administration of databases (ex. Oracle, MongoDB)
A Bachelor’s degree in engineering, computer science

 

The teamwork with listed technologies gives an opportunity to learn and grow within the role:




Web Services: Tomcat, JBoss, Apache, Nginx
Databases: Oracle, MongoDB
Languages: Java (Ant and Gradle), NodeJS
Infrastructure Tooling: Terraform, Saltstack
Misc: Docker, Elastic Search, Memcached, Kafka, Jenkins, Atlassian suite (Bitbucket/Jira/Confluence), Qualys."
8062c35a623a4c1b89ed5c9ae2ee1152,Trinnovo Group,Senior DevOps Engineer,"Dublin, County Dublin, Ireland Hybrid"," 

An Irish business that has harnessed the power of AI and ML to make a positive change on society, is looking for a Senior DevOps Engineer to join their Dublin based team!

This is an opportunity with infinite potential, as this company is going from strength to strength as they develop their ground-breaking product!

 

Working on cloud-based AI and ML products, you will get the chance to work on unique projects that will challenge and empower you. 

 

The right person for this role is someone who is motivated, has a deep interest in managing production-grade web services in a cloud deployment environment.

 

You will care about agility as much as scalability and availability. Continuous deployment keeps the team focused on incremental releases.

HQ in Dublin, Ireland, but there is hybrid and remote possibilities with this role

 

This Role will Take ownership and manage Production Web Service Infrastructure & Internal ML Build Infrastructure, Bring news ideas and technologies to the product . 

They will also Provide technical guidance and educate team members and co-workers on development and operations. 

 

 

· Chance to work on ML and AI software, without having to have experience previously.

· Work on software that has a real positive benefit on society.

· Chance to work on cloud and embedded devices.

· Stock Options in the company

· Remote working

 

If this sounds like the next role for you please don't hesitate to reach out"
dfc52dcf4d814902bcba117824d896ff,Mastercard,"Senior DevOps Engineer – Builders Enablement, Automation Frameworks","Dublin, County Dublin, Ireland Hybrid","Our Purpose

We work to connect and power an inclusive, digital economy that benefits everyone, everywhere by making transactions safe, simple, smart and accessible. Using secure data and networks, partnerships and passion, our innovations and solutions help individuals, financial institutions, governments and businesses realize their greatest potential. Our decency quotient, or DQ, drives our culture and everything we do inside and outside of our company. We cultivate a culture of inclusion for all employees that respects their individual strengths, views, and experiences. We believe that our differences enable us to be a better team – one that makes better decisions, drives innovation and delivers better business results.

Job Title

Senior DevOps Engineer – Builders Enablement, Automation Frameworks

Overview

The Automation Frameworks team in Mastercard’s Architecture & Technology division is leading the DevOps transformation at Mastercard by developing automation tooling and driving standards throughout the development, quality, release, and product organizations.

Our team members have an appetite for change and pushing the boundaries of what can be done with automation. We are responsible for automation standards with Mastercard, maintaining industry standard tools such as Chef, Jenkins, and Ansible, and working closely with other departments supporting BitBucket (git), Sonar, Artifactory, Terraform, and more.

Role

Duties

As a Senior Engineer at Mastercard, you are expected to carry out the following general duties

We demonstrate 'Mastercard values every day - own it, simplify it, sense of urgency, thoughtful risk-taking, unlock potential, and be inclusive – with a relentless focus on our customers.

 Estimate and own delivery tasks (design, dev, test, deployment, configuration, documentation) to meet the business requirements
 Drive adoption of technology standards and opinionated frameworks, and review coding, test, and automation work of team members
 Automate build and deploy aspects of software
 Report status and manage risks within their primary application/service
 Identify opportunities to improve an overall process and trim waste


The Automation Frameworks team is looking for a DevOps Engineer who can help us solve problems, build our CI/CD pipelines and lead Mastercard in DevOps automation and best practices.

 Are you a born problem solver who loves to figure out how something works?
 Are you a CI/CD geek who loves all things automation?
 Do you have a low tolerance for manual work and look to automate everything you can?


All About You

Mastercard is seeking an engineer with experience in industry standard CI/CD tools like Git/BitBucket, Jenkins, Maven, Artifactory, and Chef. Experience designing and implementing an effective and efficient CI/CD flow that gets code from dev to prod with high quality and minimal manual effort is required.

 Bachelor or master's degree in Computer Science or equivalent
 Experience in one or more of the following is preferred: Java, Python, Go, Groovy, Perl or Ruby.
 Design, implement, and enhance our deployment automation based on Chef and Ansible. We need proven experience writing chef recipes/cookbooks or Ansible playbooks as well as designing and implementing an overall Chef or Ansible based release and deployment process.
 Use Jenkins to orchestrate builds as well as link to Sonar, Chef, Maven, Artifactory, etc. to build out the CI/CD pipeline.
 Engage in and improve the whole lifecycle of services—from inception and design, through deployment, operation and refinement.
 Scale systems sustainably through mechanisms like automation, and evolve systems by pushing for changes that improve reliability and velocity.
 Practice sustainable incident response and blameless postmortems.
 Take a holistic approach to problem solving, by connecting the dots during a production event thru the various technology stack that makes up the platform, to optimize mean time to recover
 Work with a global team spread across tech hubs in multiple geographies and time zones
 We support many different stakeholders. Experience in dealing with difficult situations and making decisions with a


COVID-19 Considerations 

We value the safety of each member of our community because we know we’re all in this together. In many locations, which may change over time, we’ve implemented a virtual hiring process and continue to interview candidates by video or phone. In addition, in some locations, only individuals who have been fully vaccinated will be permitted inside Mastercard offices until further notice.

In the US, Mastercard is a government contractor, which may legally require most Mastercard employees to be vaccinated unless a verified approved medical or religious exemption is granted. Further, we are currently making every effort towards having employees return to work in the office 2 days per week, if that makes sense for their team. Everyone must be vaccinated to enter Mastercard offices at this time. Therefore, we expect all candidates to be vaccinated or to be approved for a medical or religious accommodation prior to commencing work at Mastercard.

Corporate Security Responsibility

Responsibilities

All activities involving access to Mastercard assets, information, and networks comes with an inherent risk to the organization and, therefore, it is expected that every person working for, or on behalf of, Mastercard is responsible for information security and must

Abide by Mastercard’s security policies and practices;
Ensure the confidentiality and integrity of the information being accessed;
Report any suspected information security violation or breach, and
Complete all periodic mandatory security trainings in accordance with Mastercard’s guidelines."
74e4c54c93664f4c86c82156eeb4b057,"Susquehanna International Group, LLP (SIG)",Database Devops Engineer MySQL,"Dublin, County Dublin, Ireland Hybrid","Do you aspire to work in a database environment that’s mature but constantly evolving driven by business need and technical innovation. You could be piloting an idea that could improve database performance, or managing a diverse suite of technologies that stores data in Terabytes and moves millions of messages and updates per day. We’re constantly challenged to expand our knowledge!




We are currently recruiting for a MySQL database engineer to work with our cross-functional team. You will have the opportunity to design high availability systems, build, manage, monitor and performance tune our systems in support of SIG’s trading environment. We work in a complex, distributed environment where we continually strive to improve systems capacity, increase speed, ensure stability and mitigate risk in every system.




 

Experience and Requirements: 

Minimum 5 years Technical experience Engineering Database systems.
Experience building Highly Availability infrastructure.
RDBMS – MySQL, PostGres preferred
Additional experience of MongoDB or Redis beneficial
Strong Understanding of Linux platforms (RHEL, SUSE)
Strong scripting ability with bash, python and proficiency with configuration management tools like Ansible.
Ability to work quickly in fast-paced environment and under pressure
Capable of working independently and can self-assign work to be productive
Experience of change management processes
Experience serving in a production support role including a 24x7 on-call rotation




Personal Skills

Initiative – proven record of seeking continuous improvement and implementing best practice
Desire and enthusiasm to learn and continually improve your skillset and knowledge.
Self-motivated and creative
Collaborative with excellent communication skills (verbal and written) – ability to convey complex subjects in a clear and concise manner
Attention to detail – thorough in work carried out
Interpersonal – friendly and approachable
Teamwork – working together to meet deadlines
Excellent time management, organization and prioritization skills




We don’t post salary ranges externally so any salary estimate you see listed here was not provided by SIG and may not be accurate.




SIG is not accepting unsolicited resumes from search firms. All resumes submitted by search firms to any employee at SIG via-email, the Internet or directly without a valid written search agreement will be deemed the sole property of SIG, and no fee will be paid in the event the candidate is hired by SIG."
11e6b954521244a18dc2d9c6f6d1cc6b,PTC,Senior Cloud DevOps Engineer,Ireland Remote,"It's fun to work in a company where people truly BELIEVE in what they're doing!

We're committed to bringing passion and customer focus to the business.

The Atlas R&D team is building the platform to support PTC’s world class SaaS Applications. Working primarily from our new location in Dublin Ireland , your job is to help architect, design, build, and run modern, scalable cloud infrastructure that supports the rapid development of wide range of solutions that enable our customers to unlock value in a variety of use cases.

Your Team:

Your team is located in Dublin , Ireland but works closely with a number of globally distributed teams and individuals. The team is responsible for cloud infrastructure security, design, and support, including platform level shared services, resource provisioning (Infrastructure-as-code), networking, monitoring and alerting services. Application teams deploy to this infrastructure frequently and you will be responsible for ensuring the continuous operation of production workloads.

Day-To-Day:

Design and support cloud infrastructure with a strong focus on security, automation, and testing
Collaborate with diverse product teams to engineer cloud infrastructure
Mentor product teams on SaaS application architecture best practice
Continual re-evaluation of existing stack and infrastructure to maintain optimal performance, availability, security, and cost optimization
Provide rotational support for production systems


Preferred Skills and Knowledge:

Strong written and verbal skills
Secure development principles
Infrastructure automation and ‘infrastructure-as-code' (Terraform/Ansible)
Experience in configuration and management of logging and metrics stacks (ElasticSearch/Fluent-bit/Kibana & Prometheus/Grafana)
Proficiency in pipeline design for CI/CD (Gitlab)


Preferred Experience:

Minimum 3 years hands-on experience
Hands on experience with a public cloud provider (Azure preferred)
Experience with container runtimes and orchestration platforms such as Docker and Kubernetes
Coding experience using Bash/Python/Ruby


Basic Qualifications:

Bachelors or advanced degree in computer science or related field
Will consider non-degree candidates with relevant work experiences


If you like wild growth and working with happy, enthusiastic over-achievers, you'll enjoy your career with us!

]]>"
