ID,Company,Job Title,Location,Description
71c13f8a9f0f46a5a6a80fd0a79c6fa3,Genesys,Senior DevOps Engineer,Greater Dublin Remote,"Are you a system administrator looking to modernize your skills? Or are you a software developer looking to make an impact on how a major company runs its software in the major clouds?

Learning DevOps here will allow you to broaden your skills and change career trajectory.

The Genesys Multicloud Reporting and Analytics platform is the foundation on which decisions are made that directly impact our customer’s experience as well as their customers’ experiences. We are a data-driven company, handling tens of millions of events per day to answer the questions for our customers and their business.

We own the real-time (up to the second) tooling allowing our customers to make informed business decisions to efficiently operate their contact center to long-term historical reporting to establish trends and develop insights. The team is responsible for terabytes of data in multiple cloud environments including Azure, AWS, Google and supporting customers operating the software on their own. We use the latest cutting-edge technologies, including Kubernetes, Kafka, Flink.

In this role, you’ll partner with the rest of the team of developers, quality engineers and one other DevOps engineer to develop software to operationalize the software to collect, process, store and analyze data at scale. The best person for this role will have a strong engineering background, have experience with enterprise grade software taking high level business requirements and realizing them into something real. We are a team whose focus is to operationalize big data products and curate high-value datasets and improve the reliability of the data platform as our usage continues to grow on a daily basis.

As a member of the team, you will:


Help develop and deploy highly-available, fault-tolerant software and pipelines that will help drive improvements towards the features, reliability, performance, and efficiency of the Genesys Multicloud Reporting and Analytics platform.
For pipelines, you will be using Terraform, Helm charts, Kubernetes and GitHub Actions to fully automate the CD pipelines for both software and infrastructure.
The service has to be highly reliable and available. You will use Grafana, Loki, PagerDuty to provide best in class observability, allowing the troubleshooting and resolution of production incidents.
Collaborate with other engineering teams and assist internal business teams to identify and resolve pain points, including reviewing service adoption and usage trends.
Build, deploy, maintain, and automate large global deployments in AWS, Azure and Google.
Work closely with the rest of the team, many of which are located all around the world.


Skills required:


Degree in Computer Science or Computer Engineering, or equivalent experience
Minimum 3 years in IT and minimum 2 years of DevOps experience
Good understanding of the Linux
Proven ability to write automation scripts (Bash, Python)
Attention to details. Tendency to double check what you are doing
Readiness to learn new technologies
Great communication skills (English)


Additionally, experience in the following is welcomed:


Experience with Docker, Kubernetes, Helm charts, Grafana
Experience in AWS, Azure or any other public cloud
Hands-on with Terraform, Helm, Jenkins, GitHub Actions or similar technologies
Understanding of CI/CD processes
DevOps or System Administrator experience
Any development experience in Java


Covid-19:

Safety for our employees and our communities is a key priority for Genesys. We continue to experience rapid growth during the Covid-19 pandemic and are conducting remote hiring and onboarding processes. All hiring and onboarding processes are being conducted remotely at this time.

As our Covid-19 task force and internal teams plan to reopen our global offices, the policies and procedures will continue to be updated.

Reasonable Accommodations: 

If you require a reasonable accommodation to complete any part of the application process or are limited in the ability or unable to access or use this online application process and need an alternative method for applying, you or someone you know may complete the Reasonable Accommodations Form for assistance. Please use the Candidate field in the dropdown menu to ensure a timely response.

This form is designed to assist job seekers who seek reasonable accommodation for the application process. Submissions entered for non-accommodation-related issues, such as following up on an application or submitting a resume, may not receive a response.

About Genesys:

Every year, Genesys® orchestrates more than 70 billion remarkable customer experiences for organizations in more than 100 countries. Through the power of our cloud, digital and AI technologies, organizations can realize Experience as a Service℠, our vision for empathetic customer experiences at scale. With Genesys, organizations have the power to deliver proactive, predictive, and hyper personalized experiences to deepen their customer connection across every marketing, sales, and service moment on any channel, while also improving employee productivity and engagement. By transforming back-office technology to a modern revenue velocity engine Genesys enables true intimacy at scale to foster customer trust and loyalty. Visit www.genesys.com

Genesys is an equal opportunity employer committed to diversity in the workplace. We evaluate qualified applicants without regard to race, color, age, religion, sex, sexual orientation, gender identity or expression, marital status, domestic partner status, national origin, genetics, disability, military and veteran status, and other protected characteristics.

Please note that recruiters will never ask for sensitive personal or financial information during the application phase.

"
fb9ea3f5871e4bbba80d0234d76389ba,Spanish Point Technologies,Microsoft Azure Engineer,"Dublin, County Dublin, Ireland On-site","Job Description




Working as part of our expanding Microsoft cloud solution team you will be working with our clients to architect, plan and manage innovative solutions based on the Microsoft Azure cloud platform. The right candidate must be able to clearly explain the benefits of underlying concepts of cloud computing. They must also be able to articulate how we can help clients realise these benefits. They will also possess the ability to implement the proposed solutions.




Job Requirements

Experience working in client-facing role.
Good understanding of core computer networking concepts.
Experienced with DevOps in Azure, utilizing CI/CD pipelines, Azure PowerShell/CLI, ARM template.
Experience writing Infrastructure as Code (IaC) using Industry standard tools and services.
Familiar with Azure AD, including user and application management, security controls, OAuth2 and OIDC.
Experienced with scripting language, such as PowerShell and Bash.




Minimum experience required:  1 to 2 years




Qualifications: Third Level Degree or higher




Advantageous

In addition to the core requirements listed above the following additional knowledge and experience will be beneficial for this role:

Experienced with Microsoft Azure cloud and commonly used IaaS and PaaS services.
Familiar with the key Windows server features/roles including: AD DS, DNS, IIS.
Familiar with cloud security and governance strategy.
Experienced with Office 365 and other Microsoft cloud platform management.
Experienced with Microsoft server product, such as Microsoft SQL Server HA and DR configuration.
Familiar with container technologies, such as Docker and Kubernetes.




Additional Benefits:

Paid Holidays
Educational assistance
Laptop
Health Plan
Food and Snacks




Company Overview:




Spanish Point Technologies is an innovative software company working with Microsoft technologies to provide business systems which remove complexity, increase productivity, and connect users to critical business information. We employ technologies such as Azure, SharePoint, Office 365, Dynamics 365 CRM, Power BI, PowerApps and SQL Server to deliver digital transformation for our customers. Founded in 2005 and headquartered in Dublin Ireland, Spanish Point Technologies provides consulting and solution build services on Microsoft’s core information worker and related technologies. 




We provide a full end to end project implementation service including design and implementation services, project management, training and ongoing technical support and managed services.




Learn more about us at: https://spanishpoint.ie/about-us/"
75441c381e6c43e89d6aa70fedd8f0bc,Microsoft,Software Engineer - Azure Cloud Security,"Dublin, County Dublin, Ireland","Are you a software engineer who is passionate about awesome user interfaces and security?

Do you want to help protect Azure customers from the next software supply chain attacks?

We may have your next position in Cloud Security!

We are the Security Engineering (SecEng) team in the Cloud Security organization. We are a diverse and inclusive engineering team that is investing in building the next generation of security services designed to help protect cloud services from code to cloud. Cyberattacks have increased nearly 70% in the last year and attackers are increasingly shifting left to compromise source code, build systems, and supply chains. Our team is looking for someone who is creative, energetic, and driven to make a significant impact for Microsoft customers and help defend the DevOps process from the next generation of cyber security attacks.

As a software engineer in the Security Engineering (SecEng) team, you will help us build new customer-facing Azure services that will extend our portfolio of world class solutions for securing Azure customers. You will be responsible for driving new investments to solve hard problems, defining architectures, partnering with teammates, ensuring high code quality, high availability, scalability, and the security of our services. You will have opportunities to learn and grow in your role developing services in Azure and security. You will partner effectively with other senior mentors on the team to deliver value and impact to the SecDevOps product.

At Microsoft, it is our mission to empower every person and organization on the planet to achieve more. That is what inspires us, drives our work, and pushes us to challenge the status quo every day. Working in Microsoft’s Cloud + AI (Cloud Artificial Intelligence) division, your impact will enable customers to successfully transform their businesses to the cloud. The scale of platforms and services we are building in Azure is among the largest in the world. From core cloud computing platform development to the services running on them, our organization does it all.


Develop large-scale integrated services with enterprise-class quality and utilize your design, customer obsession, and communication skills to bring great experiences for all users. 
Build and innovate shift-left security solutions and services powering the future of secure clouds and integrate it with existing Azure services. 
Solve significant technological challenges impacting the team and our customers. 
Partner and collaborate with peer engineers and customers to deliver impact on our products. 
Participate and provide high quality feedback in design reviews, code reviews and other team activities. 
Prototype, design and integrate user experiences 

Required Qualifications: 

3+ years of experience as a software engineer.
3+ years of experience with one or more general purpose programming languages including but not limited to: Java, C/C++, and/or C#.
Experience with cloud services, shipping distributed systems, services, and/or highly available infrastructure.
Demonstrated excellence in Coding, Code Review and Technical communication
Cross-division collaboration skills

Passion for security, strong engineering and development skills required including C#/.NET
Experience with owning or driving large scale and highly available services, components, or feature areas
Ability to drive technical investigations and prototyping in a fast-paced startup environment
BA/BS in Computer Science or relevant work experience

#AzureSecCSS

#AzureSecOpen

Ability to meet Microsoft, customer and/or government security screening requirements are required for this role. These requirements include but are not limited to the following specialized security screenings: Microsoft Cloud Background Check: This position will be required to pass the Microsoft Cloud background check upon hire/transfer and every two years thereafter. 

Microsoft is an equal opportunity employer. All qualified applicants will receive consideration for employment without regard to age, ancestry, color, family or medical care leave, gender identity or expression, genetic information, marital status, medical condition, national origin, physical or mental disability, political affiliation, protected veteran status, race, religion, sex (including pregnancy), sexual orientation, or any other characteristic protected by applicable laws, regulations and ordinances.

Benefits/perks listed below may vary depending on the nature of your employment with Microsoft and the country where you work."
b662689781e3402ab8c4c794797e9ef0,Ericsson,Senior DevOps Kafka Engineer,"Athlone, County Roscommon, Ireland","Ericsson leads the development of the mobile world. Our innovations in 5G technologies enable telecom networks to transform intelligent societies and industries.

When joining our team at Ericsson you are empowered to learn, lead and perform at your best, crafting the future of technology.

Ericsson prides itself in fostering an equal opportunity workplace that supports well-being, collaboration, innovation and productivity – whether it is in the office or remote, online or in person.

This is an environment where you're encouraged as your own perfectly unique self, and celebrated for the skills, talent, and perspective you bring to the team. Are you in?

Our Great Opportunity! 

Are you a passionate Senior DevOps Engineer who enjoys working with the latest Cloud Native technologies?

We are looking for Cloud Native Software Flow (CI/CD and DevOps) Engineers to help, build and maintain our pipelines. Are you passionate about scalability, reliability, automation, availability, building and maintaining critical infrastructure and tools? We are building a platform that enables developers to use the cloud more effectively. If you would like to be involved and love working with, and developing, the latest technologies, then we are eager to talk to you.

In this role you will 

Address key challenges of building and automating a best-in-class CI/CD pipeline to give feedback for the development of quality, failure resistant private clouds. 
Be passionate about driving collaborations across multiple business areas within a large organization. 
Have the technical and human proficiencies needed to help craft our vision for a truly Cloud-Native solution. 

Key Requirements

Delight in building tools to automate routine tasks. 
Hands-on experience of configuration, deployment and optimization of microservices server is required and troubleshooting sophisticated applications at scale. 
Good debugging & troubleshooting skills for handling bug & support tickets
Working knowledge of Kafka (configuration, metrics & performance monitoring) would be an added advantage
Motivation to constantly seek new ways to improve system performance. 
Passionate about seamless uptime and infrastructure resiliency to failures. 
Experience with open source and proprietary cloud and virtualization technologies (Kubernetes, VMWare, OpenStack, Azure, AWS, GCP, etc.). 
Comfortable with Go, Python, bash scripts. 
Experience with some of the following: Git, GitLab, Docker, Rancher, Jenkins, ELK, Redis, Ansible, Terraform, Spinnaker, GitOps, Kubeflow. 
Developed Cloud Native Microservices using the latest 3PPs and technologies. 
Practical experience in setting up DevOps ways of working for large scale enterprise products. 
Share best practices and implement processes to drive DevOps ways of working. 
Ability to tackle problems, establish facts and draw valid conclusions. 
Experience in Agile Methodologies (exposure to scrum teams/ceremonies)
Cohesive team player; work & contribute well within & across the teams
Minimum BSc. in Computer Science, Computer Engineering or equivalent. MSc. or PhD or equivalent. 
Excellent written and verbal communication skills. 

What do we offer? 

We support all forms of workplace environments, from using the office as a full or part time workspace to full-time remote working (within Ireland). 
A healthy work-life balance (flexible hours, maternity/paternity and parental leave). 
27 days annual leave, family-friendly work environment! 
Multifaceted sports and social club which hosts many sporting (e.g. golf, football, swimming, tennis) and social (e.g. gaming, theatre, movie, nights out) activities. 
Expand your horizons in a rich multicultural environment and collaborate with colleagues from all over the globe. 
Clearly defined career paths improved with inhouse training and financial support for external study. 
Opportunities to travel around the world and work directly with our customers. 
Pension scheme, health insurance, company doctor, life cover and sick pay/income continuance plan. 
Tax saver commuter/bike to work scheme. 

What´s in it for you? 

Here at Ericsson, our culture is built on over a century of courageous decisions. With us, you will no longer be dreaming of what the future holds – you will be redefining it. You won’t develop for the status quo but will build what replaces it. Joining us is a way to move your career in any direction you want; with hundreds of career opportunities in locations all over the world, in a place where co-creation and collaboration are embedded into the walls. You will find yourself in a speak-up environment where empathy and humanness serve as cornerstones for how we work, and where work-life balance is a priority. Welcome to an inclusive, global company where your opportunity to make an impact is endless.

What happens once you apply? 

If you are a technology professional or have deep functional experience in the telecom domain, click the “apply now” button to join #TeamEricsson today

To prepare yourself for next steps, please explore here: https://www.ericsson.com/en/careers/job-opportunities/hiring-process

You can also learn more about why our software campus in Athlone is a great place to work: Video Link"
021bedd6ab2d458eb8fae9927ead3f8f,C.H. Robinson,Principal DevOps Software Engineer,Ireland Remote,"The Principal DevOps Software Engineer role assumes technical responsibility for a product or service on a software development team.




You work across not only your team, but the organization ensuring correctness in design for large scale products and services.
You anticipate business needs and apply technical expertise to drive architectural change that aligns with our long-term vision.
You will contribute to architecture and development of enterprise system designs and development, and review team engineering practices for continuous improvement.
You are responsible for providing technical guidance to our leadership team while also driving strategic projects throughout our enterprise.




C.H. Robinson is a 24/7 Technology Team supporting a global environment. Engineers will be a part of a weekly On Call rotation.




Responsibilities:

Ensure 24x7 availability of deployment tools and systems
Drive and evangelize best practices and DevOps mindset
Ensure consistent, usable, forward-looking, maintainable test infrastructure; draw from a large base of design patterns, is an expert in available technologies, and is adept at identifying practices that work well
Identify code across multiple code bases to optimize, refactor, and reuse code to improve performance and maintainability while ensuring maximum efficiency, effectiveness, and return on investment
Drive architectural, enterprise change, and influence strategic business initiatives
Define interfaces and develop code for modules across products or services
Tailor communication to a variety of audiences and perspectives and anticipate issues to prevent conflict
Design solutions that align to the long-term plan for a service or product based on deep expertise and customer insights
Partner with various technology teams to create and manage a long-term architecture and execution roadmap for a product or service
Review designs and implementation to ensure alignment with our long-term vision
Assist in the ideation of new projects and technologies to enable the next wave of customer scenarios
Facilitate knowledge transfer sessions
Provide technical guidance and mentorship to engineers through technical POCs, shared frameworks, and desired best practices and patterns for software development, delivery, and management
Apply technical expertise to solve problems and enable the team to deliver quality designs
Participate and/or lead root cause analysis when issues occur
Design products or services by using secure programming patterns and by finding, fixing, and enhancing security in existing applications
Ensure security best practices are part of design and implementation of new features and applications
Build and manage development and deployment tools and systems
Maintain inter-connectivity of tools and promote proper and efficient use of tools
Drive product readiness of new technologies/systems







Required Qualifications:

+8 years of Enterprise application development experience, and/or experience maintaining, supporting, and deploying production systems
Excellent understanding of the various phases of the software development lifecycle, and the principles of continuous integration and continuous deployment
Experience with development tool sets (code repositories, build engines, deployment tools)
Ability to perform technical analysis of complex software, hardware, and network environments
Experience with modern development languages (e.g., .Net CORE, C#, Java)
Experience with CI/CD continuous integration / continuous deployment practices
Experience building cloud-native applications and services - preferably Azure
Familiarity with containerization and/or container orchestration platforms (ex. Kubernetes)
Excellent facilitation and communication skills; ability to coordinate and motivate resources
Ability to appreciate complex problems with a thorough design and collaborate with multiple partners on common goals
Proven record of strong decision-making, conflict resolution, follow through and building technical relationships with senior executives




Nice to have:

Experience in system integration projects or global projects
Experience with software development testing techniques and technologies; including but not limited to unit testing, automated acceptance testing and end to end tests (knowledge of the supporting frameworks is a plus)
Strong Microsoft operating systems skills
Experience with database objects in relational databases (ex. MS SQL, Oracle) including schema design, stored procedure development and performance and optimization techniques
Experience with non-relational databases (ex. MongoDB, Elastic, Cosmos)
Familiarity with Linux
Experience with HTTP and REST architecture
Experience with microservice architecture, CQRS, event driven and eventually consistent system design patterns and system flows
Experience with data streaming architecture and frameworks (Kafka, ESB)
Experience directly or indirectly leading high performing teams with the ability to assess and grow engineering talent
Contributions to open-source projects, publicly available frameworks and/or patentsts







What does C.H. Robinson offer you?

Stable position in a great team
Pension and health insurance
Monthly social activities in and out of the office
Possibility to work fully remotely (100%)
Flexible work arrangements
Twice annual internal learning conferences
Office located right in Penrose Quay, near the city center and walking distance to the English Market
Annual org-wide hackathon
Opportunities to volunteer and shape philanthropic efforts our new office supports
Employee Assistance Program"
